Date,Open,High,Low,Close,Adj Close,Volume,Headline,finbert_sentiment,next_day_close
2015-10-09,0.2180544391995305,0.2174138049800966,0.2211491228895053,0.21172554494205814,23.71990966796875,0.796813703215308,"Alcoa (AA) Seals $1.1 Billion Lockheed Martin Contract || 5 Stocks to Survive a Rough Earnings Season || US Stock Futures Remain in Red After Jobless Data; Start of Earnings Season Eyed || US Stock Futures Point Lower With Jobless Data, FOMC Minutes on Tap; Dell Reportedly Eyes EMC || Alcoa Q3 Earnings Can't Overcome Weak Commodities || After Hours Most Active for Oct 8, 2015 : AA, INTC, MSFT, GM, SPLS, ABY, PRE^F, MDLZ, EBAY, ETE, ST, BABA || Dow Jones Industrial Average Surges 138 Points After Release of September FOMC Minutes || Earnings Reaction History: Alcoa Inc., 44.4% Follow-Through Indicator, 2.7% Sensitive || Alcoa Holds Historical Pattern of Rewarding Shorts in Next-Day Trade in Wake of Earnings-Driven After-Hours Moves || After-Hours Earnings Report for October 8, 2015 : HELE, ANGO, ATNY, AA",negative,0.20546278471912482
2015-10-13,0.1990636667523069,0.19909226738114233,0.21015463593618502,0.20546278471912482,23.18817710876465,0.3492857444831233,Weakness Seen in Alcoa (AA): Stock Tumbles 6.8% || 3 Reasons Why Home Depot May be a Good Pick for Investors || Interesting November Stock Options for AA,positive,0.20328440890513078
2015-10-14,0.2025408414691905,0.19621317009951778,0.2115641809555919,0.20328440890513078,23.00322723388672,0.41272544128811806,"The Zacks Analyst Blog Highlights: Alcoa, OCI Resources, Solitario Exploration & Royalty, Asanko Gold and Primero Mining",negative,0.1923926379002368
2015-10-16,0.19424911877743029,0.18783760115072895,0.1980324995416092,0.1923926379002368,22.07847785949707,0.2553867060301043,A Spin-Off and a Second Catalyst Will Make These Shares Soar,neutral,0.18858051264527004
2015-10-20,0.1830151451953767,0.1792003093058554,0.19464957359405935,0.18858051264527004,21.75480842590332,0.23721414400345098,"Monday 10/19 Insider Buying Report: AA, CAL || Alcoa's Management Sets the Tone for Earnings Season",negative,0.1877636271182761
2015-11-03,0.17873552104709023,0.1823411502585207,0.19126667002272627,0.1877636271182761,21.68545150756836,0.23737742699921044,Interesting December Stock Options for AA || Johnson Controls Executes Well in a Difficult Quarter,neutral,0.1877636271182761
2015-11-04,0.1854224085675622,0.18050898611114727,0.19352194652902058,0.1877636271182761,21.75503158569336,0.20114287970954361,"Alcoa Inc. (AA) Ex-Dividend Date Scheduled for November 04, 2015 || Alcoa to Cut Capacity as Lower Aluminum Prices Hurt",positive,0.17986707422833959
2015-11-06,0.17632825767490484,0.17187169426627366,0.185346549614514,0.17986707422833959,21.08243560791016,0.21362770008685644,December 24th Options Now Available For Alcoa (AA),negative,0.15236533352959392
2015-11-11,0.1568025401705852,0.1532884337712346,0.15997467213654032,0.15236533352959392,18.73994445800781,0.3216360348610462,"After Hours Most Active for Nov 10, 2015 : PYPL, BRCM, FCX, SIRI, CSCO, QCOM, GE, BAC, RY, STE, QQQ, AA",negative,0.1793224910813487
2015-11-23,0.17472340127311053,0.17344211474260635,0.18224554162133225,0.1793224910813487,21.03604888916016,0.4333979292678315,Alcoa's Pending Split: What Can We Learn From Other CEO-Led Spinoffs,negative,0.17986707422833959
2015-11-24,0.17525834633020676,0.1723951608333992,0.18506465403636266,0.17986707422833959,21.08243560791016,0.2518343768677866,"One Put, One Call Option To Know About for Alcoa || Alcoa's Split Gets a Big Vote of Confidence",negative,0.18858051264527004
2015-11-25,0.17472340127311053,0.17893856563481467,0.18675609463392087,0.18858051264527004,21.82461166381836,0.23790522346100718,"Company News for November 24, 2015 || Dow Jones Futures Down 110 Points Ahead of a Busy Day of Data || The Alcoa Break-Up: Who Gets the Debt? || Alcoa (AA) Shares Rally on Elliott Management Stake Buy",neutral,0.19048656446624573
2015-12-01,0.1856898917113632,0.18286461682564625,0.19746868600908982,0.19048656446624573,21.986961364746094,0.2366705508611343,Will Alcoa's Breakup Hurt More Than Help?,positive,0.17714413688036992
2015-12-03,0.1830151451953767,0.17762988882952274,0.1833731910625878,0.17714413688036992,20.850509643554688,0.21324002321909516,Alcoa in 2015: Why It's Fallen 39%,positive,0.17850560555435474
2015-12-07,0.1856898917113632,0.17946205297689616,0.18450081812762656,0.17850560555435474,20.96646881103516,0.36201181865106985,This Legendary Investor Just Added These 3 Stocks to His Holdings,negative,0.16434629244148502
2015-12-08,0.1683039756659338,0.16244919218323373,0.17181489057674806,0.16434629244148502,19.76043510437012,0.4826556245169545,"Zacks Earnings Trends Highlights: AutoZone, Costco, Adobe, Alcoa and Bank of America || Pre-Market Most Active for Dec 7, 2015 : GMCR, SAN, BLUE, PBR, KMI, TVIX, FCAU, SDRL, GBT, XIV, AA, AAPL",negative,0.1736043140054063
2015-12-11,0.1728510617275154,0.1676839201793573,0.1788626380499991,0.1736043140054063,20.54899978637696,0.2960164012073322,Thursday's ETF with Unusual Volume: VLUE || January 2016 Options Now Available For Alcoa (AA),negative,0.18068395975533352
2015-12-15,0.17606077453110386,0.17605946835319014,0.18816566202954446,0.18068395975533352,21.152013778686523,0.261783475608938,Romick Maintains Conviction in 3 Stocks With Declining Prices || Alcoa Inc.'s Best Business Segment in 2015,neutral,0.20981949312108245
2015-12-23,0.192109296088034,0.19909226738114233,0.20508024701486025,0.20981949312108245,23.633665084838867,0.37921731498454386,Instant Analysis: Alcoa's Fastener Deal With Boeing Pushes Supply Contract Value to $2.5 Billion || Why This 127-Year-Old American Icon Is Breaking Up,negative,0.20791341968709143
2015-12-24,0.20441318101478562,0.19935399027722706,0.21635665192254863,0.20791341968709143,23.47131729125977,0.09178294145836272,"After Hours Most Active for Dec 23, 2015 : BAC, AA, NKE, WFC, QQQ, ETE, CCI, AMAT, INTC, MSFT, VIAB, AAPL",negative,0.20818572206709451
2015-12-29,0.20307580775679246,0.20040094418643417,0.21410137541625426,0.20818572206709451,23.494508743286133,0.1090927110723845,Flattish Readings for a Flattish Year || Dow Jones Industrial Average Falls 23 Points as Oil Prices Slump Again || Factors Pinning Industrial Metals Down,positive,0.2035567112851338
2015-12-30,0.19852872169521085,0.19411928305605958,0.20987271798181698,0.2035567112851338,23.10022735595703,0.21540492790612722,"Alcoa's Worst Business Segment in 2015 || Zacks Industry Outlook Highlights: Alcoa, Ford Motor, General Motors, Boeing and Lockheed Martin || Zacks Industry Outlook Highlights: Rio Tinto, BHP Billiton, Vale and Alcoa || When Will the Earnings Recession End? || When Will the Earnings Recession End?",negative,0.20110605470415188
2015-12-31,0.19665638214961562,0.1928105854758117,0.20874506854056143,0.20110605470415188,22.891489028930664,0.10812772122504272,"Zacks Earnings Trends Highlights: Alcoa, FedEx and Darden",negative,0.19674934630219437
2016-01-04,0.18729474811315733,0.18809934482176977,0.1985963130741287,0.19674934630219437,22.52040100097656,0.3670116452419968,The Best Alcoa Inc. Headlines In 2015,neutral,0.18476838739030332
2016-01-05,0.19264426237563603,0.1873141345836034,0.19042093853583877,0.18476838739030332,21.49991226196289,0.3817962243402038,Will 2016 Be Alcoa Inc.'s Best Year Yet?,neutral,0.15753892745854547
2016-01-07,0.15707000208388028,0.1543353669054857,0.1642033071947609,0.15753892745854547,19.180606842041016,0.32657371265281204,"ADP Report Buried Under China, N. Korea News || Will Alcoa Inc. Raise Its Dividend in 2016? || Alcoa, J.P. Morgan, Wells Fargo, Citigroup and Intel are part of Zacks Earnings Preview:",negative,0.15209303114959083
2016-01-08,0.16054719803126977,0.1556440437107775,0.1582832091627654,0.15209303114959083,18.71674919128418,0.40717673067950794,"EWJ, PICK: Big ETF Inflows || Pre-Market Most Active for Jan 7, 2016 : TVIX, XIV, ATML, QQQ, SUNE, AAPL, BP, BAC, EPZM, FCX, YZC, AA",negative,0.15018697932861513
2016-01-11,0.1543952555678939,0.14857717234223664,0.15490028321521554,0.15018697932861513,18.554399490356445,0.472604353656286,What to Watch in the Stock Market This Week || 3 Stocks That Could Make Huge Moves This Week,negative,0.13058174829377536
2016-01-12,0.1469059398465249,0.14151030097369569,0.13234749577605556,0.13058174829377536,16.884502410888672,0.9302530987695045,"Materials ETFs Fall; Alcoa Slides On Revenue Miss || Interesting January 2017 Stock Options for AA || China Shadow Looms as Q4 Earnings Begin || Company News for January 11, 2016 || Alcoa Beats on Q4 Earnings, Details Company Split || After Hours Most Active for Jan 11, 2016 : F, YHOO, QQQ, LYG, BHI, WMB, HPE, AMAT, AAPL, AA, LSCC, XIV || Earnings Reaction History: Alcoa Inc., 55.6% Follow-Through Indicator, 3.1% Sensitive || Alcoa Consistently Adds to Earnings-Driven After-Hours Declines in Next-Day Regular Session Trade",neutral,0.12649734227182088
2016-01-13,0.12845013368690333,0.12632960432740672,0.13178368224353615,0.12649734227182088,16.536609649658203,0.4490253017760887,"Midday Update: Stocks Drift Off Highs As Oil Targets $29 Per Barrel || Alcoa Posts Strong Q4 Results || Awaiting New Catalysts, Q4 Earnings on the Way || Alcoa's Q4 Earnings Beat, Charges & Lower Prices Hit Net || Pre-Market Most Active for Jan 12, 2016 : XIV, TVIX, AAPL, AA, QQQ, FB, LULU, NOK, SUNE, RIO, SAP, BAC || US Stock Futures Follow Europe Higher to Buck Weaker Asia, Oil || Why Alcoa, Penn National Gaming, and Eldorado Gold Slumped Today || Brutal Earnings Season? Hide Out in These 5 Blue Chip Stocks || Alcoa Sinks and Burlington Stores Jumps as Stocks Rebound || Dow Jones Industrial Average Rises 117 Points as Tech Rebounds || Preliminary Results Create a Stir for These 4 MedTech Stocks",neutral,0.12949258199979363
2016-01-14,0.12229819122352754,0.12449744018003325,0.12529974830280452,0.12949258199979363,16.791730880737305,0.43415328400077263,Q4 Earnings: 5 Things to Keep in Mind Before Picking Stocks,negative,0.12023456043587227
2016-01-15,0.11828607144954793,0.11533668176803413,0.12304447179651021,0.12023456043587227,16.0031681060791,0.5178609066838945,What Alcoa's Outlook Means for Industrial Stocks,negative,0.11587785203391468
2016-01-20,0.10678461472369337,0.10984021010086983,0.1052841441361986,0.11587785203391468,15.632079124450684,0.679166001088047,"What Investors Missed in the Stock Market Last Week || Stock Market News for January 19, 2016 || Alcoa's ""Weak"" Earnings Shouldn't Doom it's Future || Daily Dividend Report: LNT, EPR, ADP, SJM, AA, GT, NRG",positive,0.12540815436482383
2016-01-21,0.1129365571870692,0.12161834289840873,0.12135300882273528,0.12540815436482383,16.44383430480957,0.4693143152101022,Alcoa (AA) Delays Curtailment of Intalco Aluminum Smelter,positive,0.11941767490887831
2016-01-22,0.12764770548600624,0.12580611698532515,0.12473593477028513,0.11941767490887831,15.933588981628418,0.3297710468617135,"After Hours Most Active for Jan 21, 2016 : QQQ, SBUX, AAPL, DYAX, BAC, CSCO, MU, AA, HPE, KKR, GE, XRX",negative,0.12676962303880865
2016-01-26,0.11694867696104881,0.11952445585495053,0.12304447179651021,0.12676962303880865,16.559799194335938,0.3526906126453947,Interesting July Stock Options for AA,negative,0.1218683314898602
2016-01-27,0.12149576302263045,0.12214180946553427,0.12727310685473078,0.1218683314898602,16.1423282623291,0.33148926496577263,Alcoa Won Big in 2015 -- in Aerospace,negative,0.13085405067377845
2016-01-29,0.11935596156374013,0.12240355313657506,0.1289645698285057,0.13085405067377845,16.907695770263672,0.3443944188099986,What Does Alcoa's $1.5 Billion Deal With General Electric Mean for the Spin-Off?,negative,0.12214063386986329
2016-02-02,0.12042587290843822,0.116645358573326,0.12699121127657945,0.12214063386986329,16.165517807006836,0.201020683272252,Steven Romick Comments on Alcoa || Interesting June Stock Options for AA || Alcoa (AA) Seals Fourth Multi-Year Contract with Boeing,negative,0.13793371803672103
2016-02-03,0.12149576302263045,0.1297321681761568,0.12529974830280452,0.13793371803672103,17.586410522460938,0.32552971408767717,"Alcoa Inc. (AA) Ex-Dividend Date Scheduled for February 03, 2016",negative,0.15345449982357565
2016-02-05,0.15038311456340842,0.15407364400940093,0.15433646968269613,0.15345449982357565,18.914121627807617,0.41998287680335944,"March 24th Options Now Available For Alcoa (AA) || S&P 500 Movers: RL, FCX",negative,0.1319432385807755
2016-02-11,0.12952004503160147,0.12920870160903125,0.1326293913542069,0.1319432385807755,17.073959350585938,0.3038880086233674,5 Things Alcoa's Management Wants You to Know,negative,0.16434629244148502
2016-02-17,0.1527903991660997,0.15669099761998465,0.16335757570787343,0.16434629244148502,19.845853805541992,0.27399544883457716,Better Buy: Alcoa Inc. vs. Barrick Gold || AA: Insiders vs. Shorts,neutral,0.1646185732084727
2016-02-23,0.16669914049464551,0.16114051537794183,0.1720967861548994,0.1646185732084727,19.8691463470459,0.24703048987177095,"Why Alcoa, Marathon Oil, and Teck Resources Jumped Today || Why Century Aluminum Co, Alcoa Inc, and Freeport-McMoRan Inc All Popped Today",negative,0.17387659477239406
2016-02-26,0.17659571958819992,0.17265690450444,0.18083599660192537,0.17387659477239406,20.661117553710938,0.20337309759487945,"Analyst Favorites: Alcoa Ranks As a Top Metals Pick || Stock Market News for February 25, 2016",negative,0.20573506548611264
2016-03-07,0.1910394059738419,0.19516621619031066,0.20310688846293398,0.20573506548611264,23.38642883300781,0.40981151066643007,Better Buy: Freeport-McMoRan Inc. vs. Alcoa Inc.,neutral,0.18640215844429125
2016-03-08,0.19398163563362925,0.1907166984323535,0.19408576006153996,0.18640215844429125,21.73261260986328,0.36631213582512473,Alcoa (AA) Clinches U.S. Army Contract for Combat Vehicles || Monday's Vital Data: Apple Inc. (AAPL) Seadrill Ltd (SDRL) and Alcoa Inc (AA) || Cash Dividend On The Way From Alcoa Preferred Stock,negative,0.1888527934122578
2016-03-09,0.18488746351046603,0.18077072978218803,0.1892932890945833,0.1888527934122578,21.942249298095703,0.19699215001175893,Tuesday's ETF with Unusual Volume: XME || The Math Shows SPXT Can Go To $45,negative,0.19348180419421845
2016-03-10,0.18355009025247282,0.18364982706381255,0.1921124015096137,0.19348180419421845,22.33823204040528,0.2302653766381778,Wednesday's ETF with Unusual Volume: XME,negative,0.1817731476623306
2016-03-15,0.18675980305606127,0.18077072978218803,0.1890113935164319,0.1817731476623306,21.33662414550781,0.2990820204663211,14.0% of JKI Holdings Seeing Recent Insider Buys,negative,0.1975662318291883
2016-03-16,0.17846805913379515,0.1873141345836034,0.18872947556206385,0.1975662318291883,22.687633514404297,0.3313133243734427,"Why Alcoa, 3D Systems, and Sanderson Farms Slumped Today",positive,0.20546278471912482
2016-03-18,0.20013357809700505,0.19909226738114233,0.2084631729624101,0.20546278471912482,23.36313819885254,0.32178035677714306,"Alcoa Inc: AA Stock Is Good for a Trade, But Be Quick!",neutral,0.2005614715571611
2016-03-22,0.1937141524898282,0.1922871189086861,0.20508024701486025,0.2005614715571611,22.9438591003418,0.17659357242183113,Monday's ETF with Unusual Volume: PICK,neutral,0.18612985606428817
2016-03-23,0.19184183417473893,0.18809934482176977,0.19295813299650114,0.18612985606428817,21.70932006835937,0.2354010951858857,"Pre-Market Most Active for Mar 22, 2016 : TVIX, RIG, AA, BAC, CTRE, VRX, SIRI, AGRO, AZN, XIV, QQQ, FB || Better Buy: Alcoa Inc. vs. Hecla Mining",negative,0.19702164868219746
2016-03-29,0.18809717631405448,0.18679066801647792,0.19634103656783428,0.19702164868219746,22.641048431396484,0.22676463983948142,"Ignore Freeport-McMoRan Inc.: Here Are 3 Better Stocks || After Hours Most Active for Mar 28, 2016 : XOM, P, BAC, F, GE, YHOO, AA, VIAV, MSFT, CSCO, AAPL, INTC",negative,0.19593246077520038
2016-03-30,0.19558649203542344,0.1899314881941871,0.20367070199545342,0.19593246077520038,22.54787254333496,0.1620397159939112,Better Buy: Silver Wheaton Corp. vs. Alcoa,neutral,0.1945709921012156
2016-04-01,0.18515494665426702,0.18391157073485337,0.19577722303531495,0.1945709921012156,22.4314079284668,0.15266370259508577,Alcoa (AA) to Divest its Stake in DBP to DUET Group,negative,0.19103116922625196
2016-04-06,0.184619980366665,0.18129419634931357,0.19324002857465247,0.19103116922625196,22.12859535217285,0.14476680530110272,"Oil Gets Lit Up Again || Alcoa, FedEx and Nike are part of Zacks Earnings Preview",negative,0.19048656446624573
2016-04-07,0.18488746351046603,0.18809934482176977,0.1980324995416092,0.19048656446624573,22.082002639770508,0.28998520833264774,Energy Isn't the Only Drag on Earnings Growth || Wednesday's ETF with Unusual Volume: PYZ,positive,0.18749132473827296
2016-04-08,0.192109296088034,0.18626718067439635,0.19577722303531495,0.18749132473827296,21.825782775878903,0.33810933986330305,Alcoa (AA) Inks Bauxite Supply Contracts Worth Over $350M || Bull Market Mojo on the Wane?,negative,0.19048656446624573
2016-04-12,0.18248017890777485,0.1802472632150625,0.19042093853583877,0.19048656446624573,22.082002639770508,0.6714450190712008,"ForexLive Asia FX news wrap: OZ business conditions to strongest in 8 years || Materials ETFs Pop As Investors Gird For 'Steep Decline' In Earnings || Q1 2016 Tracking Ever-Lower || Alcoa, CSX, Fastenal, J.P. Morgan and Delta Airlines are part of Zacks Earnings Preview: || Monday's Vital Data: Apple Inc. (AAPL), Facebook Inc (FB) and Tesla Motors Inc (TSLA) || Stock Futures Buoyant on Europe, Firm Dollar || How The Parts Add Up: RPV Targets $57 || 3 Stocks to Watch on Monday: Alcoa Inc (AA), Apple Inc. (AAPL) and Wal-Mart Stores, Inc. (WMT) || Earnings Reaction History: Alcoa Inc., 66.7% Follow-Through Indicator, 3.9% Sensitive || Stocks Collapse on Low Earnings Expectations || After Hours Most Active for Apr 11, 2016 : PFE, T, BAC, VZ, AAPL, QQQ, AA, ETP, YHOO, CLNE, MSFT, SYMC || Why Alcoa Inc (AA), American Airlines Group Inc (AAL) and Hatteras Financial Corp. (HTS) Are 3 of Today's Best Stocks || Close Update: Stocks Trade Lower as Alcoa Starts Earnings Season || Stocks Trade Lower as Alcoa Starts Earnings Season || 3 Stocks to Watch for Earnings This Week: AA, BAC, DAL || Alcoa Holds Bullish History for Shorts Trading Shares off Earnings-Driven After-Hours Moves",neutral,0.19892770050317315
2016-04-13,0.1891670664282466,0.19516621619031066,0.20056969400227162,0.19892770050317315,22.804094314575195,0.4811649393688467,"Mid-Morning Market Update: Markets Open Higher; Alcoa Revenue Misses Views || SunCoke Energy, Lindsay and Alcoa highlighted as Zacks Bull and Bear of the Day || Tuesday's Vital Data: Alcoa Inc (AA), Chesapeake Energy Corporation (CHK) and Netflix, Inc. (NFLX) || Alcoa's (AA) Q1 Earnings Top, Lower Prices Dent Profits || Stock Futures Buoyed by Higher Oil, Shrugging Off Downbeat Alcoa Earnings || Pre-Market Most Active for Apr 12, 2016 : SRC, AA, E, HQY, CHK, TVIX, BHP, QQQ, JNPR, QAT, FOLD, SBUX || 3 Big Stock Charts for Tuesday: Bank of America Corp (BAC), Citigroup Inc (C) and General Motors Corporation (GM) || Oil Gives Stocks a Lift Ahead of Bank Earnings || Earnings Previews for Q1 Frontrunners: JPM, CSX and PGR || Close Update: Oil's Rally Fuels Triple-Digit Gains in Dow || Mid-Afternoon Market Update: Crude Oil Up 4.5%; Horizon Pharma Shares Tumble || 3 Stocks That Could Really Use an Earnings Beat",positive,0.20491817995911865
2016-04-14,0.1971913484372177,0.19699838033768413,0.2073355235211545,0.20491817995911865,23.31654930114746,0.29841412972568204,"Alcoa Q1 Earnings: So Many Moving Parts || 3 Big Stock Charts for Wednesday: Alcoa Inc (AA), JPMorgan Chase & Co. (JPM) and ConocoPhillips (COP) || What Investors Can Learn From the Masters || Dismal Earnings Outlook Projected for 1st Quarter",positive,0.2190775146850038
2016-04-19,0.20494812607188173,0.2072060926588904,0.2186119284288429,0.2190775146850038,24.527801513671875,0.2416629854156641,Interesting May Stock Options for AA || Peabody Energy's Bankruptcy: It's More Than Just the Coal Market,negative,0.21608227495703097
2016-04-21,0.21832190111282562,0.21191733331293233,0.22396821292831906,0.21608227495703097,24.27157211303711,0.21588006876619067,"After Alcoa Inc.'s Earnings, These 4 Industrials Could Disappoint",positive,0.21553767019702486
2016-04-22,0.21216995864944982,0.2100851899405149,0.22312248144143157,0.21553767019702486,24.224987030029297,0.1800437294646318,Highlights From Alcoa Inc's Q1 Earnings || A New ETF That Capitalizes on Social Media $BUZ,negative,0.20900260759408845
2016-04-25,0.2084253007887653,0.20249483122989237,0.21692046545506802,0.20900260759408845,23.66594696044922,0.17202461041816397,What Investors Should Know About Alcoa Inc.'s Spinoff,negative,0.22261733755996743
2016-04-26,0.20762289381837407,0.21087040017868125,0.21917574196136227,0.22261733755996743,24.830610275268555,0.25545308246652004,"Monday 4/25 Insider Buying Report: UAL, AA",negative,0.24031649516081616
2016-04-27,0.2177869560557295,0.22893019410659476,0.23270742337534503,0.24031649516081616,26.344669342041016,0.45831491442072386,"Buy Alcoa Stock, Profit 50%? 3 Things to Know About Alcoa's New Buy Rating",neutral,0.23595976514584327
2016-04-28,0.2327655874984676,0.22945366067372036,0.2451114553480722,0.23595976514584327,25.97197914123535,0.2504869757128569,"After Hours Most Active for Apr 27, 2016 : FB, QQQ, ETE, MSFT, BSBR, JD, AAPL, CSCO, FBR, BAC, AA, PFE",negative,0.21118096179506723
2016-05-04,0.20762289381837407,0.20511218484047616,0.218893846383211,0.21118096179506723,23.92163276672364,0.20589408578863283,"Under Armour Inc: Join the Club, UA  China's Ripping You Off! || Zacks Industry Outlook Highlights: BHP Billiton, Rio Tinto, Vale, Alcoa and Freeport-McMoRan || Alcoa Inc. (AA) Ex-Dividend Date Scheduled for May 04, 2016",negative,0.20519048233912174
2016-05-05,0.2086927839325663,0.20328004146805873,0.21240991244247934,0.20519048233912174,23.407695770263672,0.20108073091038248,"Zacks Industry Outlook Highlights: Alcoa, Boeing and Lockheed Martin",negative,0.1956601583951974
2016-05-10,0.1883646382273496,0.18495850386910445,0.19493149154842745,0.1956601583951974,22.59006118774414,0.20211209719413997,Why Have Aluminum Prices Declined Over The Past Year?,positive,0.18558527291729732
2016-05-17,0.18060786059268547,0.17893856563481467,0.1895752070489514,0.18558527291729732,21.7257022857666,0.16952260861926635,Interesting January 2017 Stock Options for AA,negative,0.17796102240736392
2016-05-18,0.17846805913379515,0.17632121202423087,0.18450081812762656,0.17796102240736392,21.07159423828125,0.21236353528697433,Tuesday's ETF with Unusual Volume: VV || AA: Insiders vs. Shorts,negative,0.1888527934122578
2016-05-24,0.18355009025247282,0.18155594002035438,0.19324002857465247,0.1888527934122578,22.00603485107422,0.16229150090489158,"Pre-Market Most Active for May 23, 2016 : XNPT, MON, LBTYK, ING, TVIX, DCM, AAPL, LBTYA, AA, ACAS, AZN, SDRL",negative,0.18694674159128216
2016-05-27,0.1870272649693564,0.18155594002035438,0.19464957359405935,0.18694674159128216,21.84250831604004,0.22095257527662548,"Baker Hughes Incorporated (BHI) Ex-Dividend Date Scheduled for May 27, 2016",negative,0.18640215844429125
2016-06-02,0.1800729155355893,0.17762988882952274,0.19098475206835822,0.18640215844429125,21.79578971862793,0.11256393035587847,Insiders Bullish on Certain Holdings of VLUE,negative,0.19892770050317315
2016-06-07,0.19451658069072536,0.1894080216270616,0.20677170998863517,0.19892770050317315,22.870386123657227,0.07916746936924918,Interesting August Stock Options for AA || Alcoa $3.75 Preferred Stock About To Put More Money In Your Pocket,negative,0.200289169177158
2016-06-09,0.192109296088034,0.1894080216270616,0.20056969400227162,0.200289169177158,22.987192153930664,0.1749796275983198,Why Alcoa Inc.'s Shares Fell 15% in May,positive,0.19075886684624888
2016-06-10,0.19077192283004085,0.18679066801647792,0.1985963130741287,0.19075886684624888,22.1695613861084,0.16632317324933416,"Commit To Buy Alcoa At $7, Earn 11.3% Using Options",negative,0.18966967893925185
2016-06-15,0.18034037744888443,0.18260287315460538,0.19183048355524565,0.18966967893925185,22.07611656188965,0.1547970139210779,"Notable Two Hundred Day Moving Average Cross - AA || Notable Tuesday Option Activity: DECK, AA, ALLY",negative,0.20083377393716417
2016-06-21,0.19291172428893122,0.1907166984323535,0.2047983290604923,0.20083377393716417,23.033916473388672,0.11116913915938878,"One Put, One Call Option To Know About for Alcoa",negative,0.1877636271182761
2016-06-24,0.1883646382273496,0.1865289243454371,0.19577722303531495,0.1877636271182761,21.91259002685547,0.32586577327662397,"5 Basic Materials Stocks to Buy on Strong Momentum || After Hours Most Active for Jun 23, 2016 : FBHS, BAC, TVIX, AA, FCX, MSFT, DOW, HPE, XIV, WFM, LXRX, AAPL",neutral,0.18640215844429125
2016-06-28,0.18274766205157578,0.17710642226239717,0.19126667002272627,0.18640215844429125,21.79578971862793,0.15901725913922776,"FedEx, Oracle, Adobe and Alcoa are part of Zacks Earnings Preview: || Monday's Vital Data: Apple Inc. (AAPL), Bank of America Corp (BAC) and Alcoa Inc. (AA) || 1 Unexpected Company Poised to Dominate 3D Printing",neutral,0.18476838739030332
2016-06-30,0.17846805913379515,0.17448906865181343,0.1864741990557696,0.18476838739030332,21.65562438964844,0.22871674501297024,"Wednesday's Vital Data: Bank of America Corp. (BAC), Apple Inc. (AAPL) and Nike Inc (NKE) || Why Alcoa Inc (AA), Esperion Therapeutics Inc (ESPR) and Southwestern Energy Company (SWN) Are 3 of Today's Worst Stocks || 3 Small-Cap Stocks to Buy Before Brexit Fears Subside",positive,0.1923926379002368
2016-07-01,0.18087534373648645,0.18260287315460538,0.19352194652902058,0.1923926379002368,22.30972480773925,0.16040154453056393,Alcoa Files Form 10 with SEC for Planned Business Split || Here's How Alcoa Plans To Apportion Its Debt Among Its Successor Companies Post The Upcoming Split,negative,0.18259003318932454
