Date,Open,High,Low,Close,Adj Close,Volume,Headline,finbert_sentiment,next_day_close
2018-10-18,0.36242209160672434,0.3746868701244327,0.3850304978603609,0.3725778827303399,38.02727508544922,0.3175639088379643,"Alcoa Corporation (AA) Q3 2018 Earnings Conference Call Transcript || Alcoa (AA) 3rd Quarter Earnings: What to Expect || Alcoa (AA) Tops Q3 Earnings and Revenue Estimates || After-Hours Earnings Report for October 17, 2018 : CCI, KMI, URI, STLD, SLG, AA, CCK, WTFC, UMPQ, TCBI, RLI, CATY",negative,0.3697450215864582
2018-10-19,0.3656500626453845,0.35802203139420985,0.37681842632666174,0.3697450215864582,37.782562255859375,0.09567877247641068,"3 Stock Charts for Thursday: Wells Fargo, CSX and Macy's || Why Alcoa, Genuine Parts, and Heartland Express Jumped Today",negative,0.3204532549733291
2018-10-26,0.30932769601125604,0.31271106284119327,0.32027220510997945,0.3204532549733291,33.52468490600586,0.06739917021859923,Alcoa (AA) Gains But Lags Market: What You Should Know,neutral,0.34243624188847993
2018-11-06,0.334483510143994,0.3300294401382548,0.350774300169977,0.34243624188847993,35.42360305786133,0.028745401811605856,How Alcoa Fell 13.4% in October on Fears Over China,positive,0.3445892440224897
2018-11-08,0.34294301752386125,0.34484260703739056,0.3564054541155566,0.3445892440224897,35.60958480834961,0.06282218329870637,10 Strong Buy Stocks Trading at Killer Entry Points,neutral,0.32169972079280196
2018-11-09,0.33303652378405274,0.3253458509506908,0.3289535506605854,0.32169972079280196,33.63235855102539,0.07586203928563565,Alcoa (AA) Dips More Than Broader Markets: What You Should Know,positive,0.33960338074459834
2018-11-15,0.32324132035615827,0.3254547532702079,0.3404504955601978,0.33960338074459834,35.17890167236328,0.03171487396704519,Alcoa (AA) Gains As Market Dips: What You Should Know,neutral,0.30402265169360915
2018-11-21,0.302203927140428,0.29528374167470256,0.315931487582243,0.30402265169360915,32.10539245605469,0.010503273634201032,First Week of AA July 2019 Options Trading,negative,0.28351274306354995
2018-11-29,0.30498665200940844,0.29626402875000457,0.29562413111402364,0.28351274306354995,30.333728790283203,0.17273062583967333,"Why Alcoa Stock Just Jumped 9% || Wednesday Sector Leaders: Metals Fabrication & Products, Restaurants & Eateries",negative,0.2420396576461631
2018-12-20,0.24053873385317853,0.23417929837229207,0.24061475321362888,0.2420396576461631,26.751235961914062,0.09265866993468935,10 Strong Buy Stocks Trading at Killer Entry Points,neutral,0.24011331120380297
2018-12-27,0.2266251095082763,0.2274262119396508,0.23472548960826403,0.24011331120380297,26.58483123779297,0.04441044332725685,New Strong Sell Stocks for December 26th,neutral,0.253484419261007
2019-01-04,0.23141139967980362,0.24321970746400068,0.24483810748470528,0.253484419261007,27.73984336853028,0.11065270921931236,"Alcoa Stock Has Been Decimated, But There Is Light Ahead",positive,0.26209631973196923
2019-01-09,0.25100178530508666,0.25051738859405154,0.2634913245086271,0.26209631973196923,28.48374938964844,0.027596092043004443,Why Alcoa Lost 16.4% in December,positive,0.26073653687317927
2019-01-10,0.2520035679563601,0.24757652736814545,0.2663069014814169,0.26073653687317927,28.36629295349121,0.027069536025671637,Analysts Estimate Alcoa (AA) to Report a Decline in Earnings: What to Look Out for,positive,0.2598300221716578
2019-01-15,0.25478629282534054,0.2525868650641727,0.2675621848628038,0.2598300221716578,28.287982940673828,0.06299938965069338,5 Fallen-Angel Stocks That Have Been Oversold,positive,0.26073653687317927
2019-01-16,0.25756901769432095,0.2510619832914611,0.26255279885103056,0.26073653687317927,28.36629295349121,0.20152412651824708,"Noteworthy Tuesday Option Activity: DIS, AA, SQ",negative,0.26764872498041553
2019-01-17,0.24666072007273315,0.26140944874189126,0.2549272750860312,0.26764872498041553,28.9633731842041,0.2731711861459062,"Alcoa Corp (AA) Q4 2018 Earnings Conference Call Transcript || Alcoa (AA) 4th Quarter Earnings: What to Expect || Alcoa Earnings: AA Stock Slides on Q4 Earnings Beat || Alcoa Earnings Tops Wall Street Estimates || Major Averages Reach Best Closing Levels In A Month - U.S. Commentary || Aluminum producer Alcoa reports fourth-quarter profit || Earnings Reaction History: Alcoa Inc., 77.8% Follow-Through Indicator, 15.3% Sensitive || After-Hours Earnings Report for January 16, 2019 : CSX, KMI, AA, HWC, FUL, EGBN, PLXS",negative,0.2640226661743294
2019-01-18,0.2656945692164225,0.2594488745912871,0.27358049210995306,0.2640226661743294,28.650150299072266,0.13464898079766657,"U.S. STOCKS ON THE MOVE-Morgan Stanley, Signet Jewelers, Lockheed Martin, Northrop",negative,0.24747874585529234
2019-01-22,0.2554541408493542,0.24746760427367226,0.25516191209448447,0.24747874585529234,27.221067428588867,0.09479274071647567,New Strong Sell Stocks for January 21st,neutral,0.2530311511037386
2019-01-23,0.24599287204871956,0.24376430216141032,0.2588573442846491,0.2530311511037386,27.70069122314453,0.07874543978439558,"Arconic no longer pursuing sale over price disagreements, shares tank",negative,0.2491784582190183
2019-01-24,0.24599287204871956,0.2423483434831718,0.2566870078969976,0.2491784582190183,27.367889404296875,0.04404084150739824,Here's Why Shareholders Should Be Glad Arconic Called off Sale Talk,negative,0.2611898050304477
2019-01-25,0.2489982200025398,0.2530770086018238,0.26255279885103056,0.2611898050304477,28.40544509887696,0.13480846651445486,"MGM Growth Properties, Alcoa, Arbor Realty Trust and Chatham Lodging Trust highlighted as Zacks Bull and Bear of the Day || Investor's Guide to Oscar Nominations || Bear of the Day: Alcoa Corp. (AA)",negative,0.2564305974442058
2019-02-01,0.2632457789747018,0.2591221053078678,0.2638432800213071,0.2564305974442058,27.99433898925781,0.09518259469084708,Alcoa (AA) Gains But Lags Market: What You Should Know,neutral,0.24566571645224933
2019-02-08,0.23452805917604386,0.23309008820251687,0.24319569317796538,0.24566571645224933,27.064453125,0.0886689954956677,Will the Departure of Arconic's CEO Derail Its Turnaround Plan?,positive,0.2742209619697004
2019-02-22,0.26524932304674276,0.2635878483064856,0.2766307060911961,0.2742209619697004,29.53109169006348,0.0484861894229579,AA April 5th Options Begin Trading,negative,0.2811331500769367
2019-02-25,0.27181655543597705,0.26783576589111313,0.2887142211357252,0.2811331500769367,30.128173828125,0.06721943234729813,Validea's Top Five Basic Materials Stocks Based On Joseph Piotroski - 2/24/2019,negative,0.23626061831908263
2019-03-08,0.23241318233107705,0.2274262119396508,0.24319569317796538,0.23626061831908263,26.252031326293945,0.04004104099112019,Validea David Dreman Strategy Daily Upgrade Report - 3/7/2019,negative,0.25665723152284003
2019-03-19,0.255788075476614,0.25095306019698804,0.2664242199856436,0.25665723152284003,28.013916015625,0.029806108404213764,"Noteworthy Monday Option Activity: CMTL, NKE, AA",negative,0.2585835779652002
2019-03-20,0.24988869111139328,0.24877466063239367,0.2570389634096776,0.2585835779652002,28.180315017700195,0.05314924799953016,Alcoa Stock Is Building Energy for a Potential Spike,neutral,0.2509915092350766
2019-03-22,0.2565672350430475,0.25040846549957846,0.25832942220373745,0.2509915092350766,27.524503707885746,0.05249611601649235,Alcoa Corporation Larger Than S&P 500 Component Quanta Services,negative,0.24985836045492088
2019-03-25,0.24565895865196563,0.24267509199163512,0.25797748906727425,0.24985836045492088,27.42662048339844,0.04022077886242129,Validea's Top Five Basic Materials Stocks Based On Joseph Piotroski - 3/24/2019,negative,0.24861189463544808
2019-03-27,0.24321014717973916,0.2364121698716009,0.25152510559210794,0.24861189463544808,27.31894874572754,0.03141615468798139,"Noteworthy Tuesday Option Activity: AA, CTXS, PDFS",negative,0.25745042918504446
2019-04-03,0.24933215462979957,0.2460516455954338,0.2643125316619971,0.25745042918504446,28.082433700561523,0.08590963944329866,"U.S. STOCKS ON THE MOVE-Airlines, Facebook, Walgreens, Lyft, Alcoa || U.S. STOCKS ON THE MOVE-Facebook, Airlines, Dow, Walgreens, Crypto stocks",negative,0.23444758891603956
2019-04-18,0.2371994725026043,0.23014922697661072,0.23381041422578272,0.23444758891603956,26.095422744750977,0.20743016107804246,"ALCOA CORP (AA) Q1 2019 Earnings Call Transcript || Alcoa Earnings: AA Stock Slides on Q1 EPS Miss || Notable Wednesday Option Activity: FB, AA, EHTH || Earnings Reaction History: Alcoa Inc., 70.0% Follow-Through Indicator, 6.4% Sensitive || Alcoa Posts Q1 Loss - Update || Alcoa Inc. Q1 adjusted earnings of -$0.32 per share || Alcoa (AA) 1st Quarter Earnings: What to Expect || Alcoa (AA) Reports Q1 Loss, Misses Revenue Estimates || Alcoa Earnings: AA Stock Slides on Q1 EPS Miss || Notable Wednesday Option Activity: FB, AA, EHTH || Earnings Reaction History: Alcoa Inc., 70.0% Follow-Through Indicator, 6.4% Sensitive || Alcoa Q1 19 Earnings Conference Call At 5:00 PM ET || After-Hours Earnings Report for April 17, 2019 : LVS, CCI, KMI, TEAM, ETFC, URI, TMK, CCK, SLG, AA, SLM, UMPQ",positive,0.23728045005992127
2019-04-26,0.23374887837910435,0.22840649901495286,0.2470671143125784,0.23728045005992127,26.34012794494629,0.024692439389731702,How The Pieces Add Up: FNK Headed For $41,negative,0.20997167036194297
2019-05-17,0.20647818740139956,0.2038993636823136,0.21785547804664065,0.20997167036194297,23.981163024902344,0.04923551913993151,"Alcoa, USW Extend Existing Labor Contract For Five U.S. Locations",negative,0.21269121446650757
2019-05-21,0.20302761450840545,0.2024289330693605,0.21245893873329777,0.21269121446650757,24.21608161926269,0.03765128675860976,Alcoa (AA) Shares Enter Oversold Territory,negative,0.1930878205379699
2019-05-24,0.1936776572501907,0.1886504836303292,0.2016658824828285,0.1930878205379699,22.5227165222168,0.06331582956495588,"Commit To Buy Alcoa Corporation At $15, Earn 7.7% Using Options",negative,0.1752974560124753
2019-06-07,0.17230632940720064,0.16719311184311322,0.17761614852178043,0.1752974560124753,20.98596572875977,0.06806242827889344,AA July 26th Options Begin Trading,negative,0.17937676136281452
2019-06-13,0.16985751793497406,0.17015576599789642,0.17972783684542692,0.17937676136281452,21.33833885192871,0.04155488954095201,Alcoa (AA) Shares Enter Oversold Territory,negative,0.1785835637006101
2019-06-14,0.17197239477994086,0.17274806501150622,0.18207413980131007,0.1785835637006101,21.269821166992188,0.048817818453105004,August 2nd Options Now Available For Alcoa (AA),negative,0.19535409648526608
2019-06-26,0.18610864220968293,0.18630868903654724,0.19814641686089549,0.19535409648526608,22.71848487854004,0.03281355334936461,First Week of September 20th Options Trading For Alcoa (AA),negative,0.19660056230473888
2019-07-16,0.19145146886280395,0.1921903907134035,0.20307368215733176,0.19660056230473888,22.826154708862305,0.0404840568710877,AA August 30th Options Begin Trading,negative,0.19762039404557752
2019-07-18,0.18755564980013023,0.19986929228663225,0.19638668404992896,0.19762039404557752,22.914247512817383,0.2363122649326097,Alcoa Earnings: AA Stock Declines as Q2 Sales Slide 25% Y2Y,positive,0.1942209693181256
2019-07-19,0.19267587459891722,0.19061105778093335,0.20049274219299532,0.1942209693181256,22.62060165405273,0.08513246301386995,Alcoa Corporation (AA) Q2 2019 Earnings Call Transcript,negative,0.15773370395259964
2019-08-06,0.15772483580777885,0.15325128814985028,0.15919756850631187,0.15773370395259964,19.468788146972656,0.06325760462073157,Interesting AA Put And Call Options For September 13th || AA Crosses Critical Technical Indicator,negative,0.1603399526308624
2019-08-08,0.15293856686675744,0.152053154885602,0.1630689896409249,0.1603399526308624,19.693920135498047,0.042997855549989035,See How Alcoa Corporation Ranks Among Analysts' Top Metals Picks,neutral,0.14164305179083092
2019-08-21,0.14047195011230246,0.13865592588974868,0.14875644539230595,0.14164305179083092,18.07885932922364,0.05318215775061346,Interesting AA Put And Call Options For April 2020,negative,0.13688384420458907
2019-08-22,0.13813445018249582,0.13359111625900671,0.1422454362293515,0.13688384420458907,17.667755126953125,0.04346618662309753,Southwest Airlines Stock May Soon Chart a Golden Route,negative,0.13042492425462127
2019-08-23,0.1311219928540877,0.12765494264743585,0.1352651306732737,0.13042492425462127,17.109827041625977,0.0489848987278356,Is The Chinese Slowdown Set To Eat Over $2.5 Billion From ArcelorMittal's Revenue Base?,positive,0.12192634082297618
2019-08-27,0.12533392003128696,0.1207929538952775,0.1278742439167276,0.12192634082297618,16.375709533691406,0.02768722673831204,October 4th Options Now Available For Alcoa (AA),negative,0.1250991530848092
2019-08-28,0.11720836850918549,0.11981266681997543,0.12529328157617445,0.1250991530848092,16.6497802734375,0.04134983647650991,AA Crosses Critical Technical Indicator,negative,0.16838526790523903
2019-09-10,0.15961708956790582,0.15913298982670662,0.16506335946034473,0.16838526790523903,20.38888359069824,0.0488962955518421,Alcoa Eliminates Business Unit Structure; To Announce Additional Changes,negative,0.19172803767917995
2019-09-13,0.1881122075122298,0.18565517124466452,0.1984983723735755,0.19172803767917995,22.405258178710938,0.07434059617786151,AA November 1st Options Begin Trading,negative,0.16589235787930864
2019-09-27,0.16729741615083343,0.16283629193896854,0.1718676760719742,0.16589235787930864,20.17354202270508,0.04569645513881967,What Is Ailing Alcoa's Revenue Growth?,negative,0.14096317116794363
2019-10-09,0.141362421221156,0.1365864286446714,0.14554201235660558,0.14096317116794363,18.020132064819336,0.043494033335552636,Why Shares of Alcoa Were Up Almost 12% in September,neutral,0.15286117932704063
2019-10-15,0.14536955182624967,0.14740224470387556,0.1546339838601132,0.15286117932704063,19.047895431518555,0.15916168231609717,Alcoa: A Virtual Washout Of Profitability?,neutral,0.16237959449952435
2019-10-17,0.1613980317856128,0.16719311184311322,0.16717504778399125,0.16237959449952435,19.87010383605957,0.19815720583049404,"Alcoa Q3 Loss Widens, To Sell Non-Core Assets || Alcoa Corp. Q3 adjusted earnings of -$0.44 per share || Alcoa Q3 19 Earnings Conference Call At 5:00 PM ET",negative,0.17643060479263104
2019-10-18,0.16262243752172612,0.16730203493758639,0.17081183191015095,0.17643060479263104,21.083850860595703,0.12021172614935408,"Why Cronos Group, Limelight Networks, and Alcoa Jumped Today || Notable Thursday Option Activity: NBIX, UNP, AA || Why Shares of Alcoa Are Soaring Today",neutral,0.17053824842623344
2019-10-25,0.16284506060656595,0.16250954343050522,0.17386204589139406,0.17053824842623344,20.574859619140625,0.11751565807983755,AA December 6th Options Begin Trading,negative,0.17711048541551835
2019-10-29,0.17141585829834716,0.1682823220128884,0.17914124432429362,0.17711048541551835,21.142578125,0.02939853379464366,"After More Than Doubling In 2 Years, Alcoa Could See Alumina Revenues Drop 22% In 2019",positive,0.18798866183377672
2019-11-07,0.18199020006216937,0.1828232331132315,0.1938057217093758,0.18798866183377672,22.082244873046875,0.04256243422796382,Aluminum Prices: 15-Year Price Analysis And Production-Demand-GDP Dynamics,negative,0.16532577268272314
2019-11-22,0.15961708956790582,0.15973205645883073,0.1713984020550676,0.16532577268272314,20.12460327148437,0.07943401303783076,AA January 2020 Options Begin Trading,negative,0.1639660114369485
2019-11-25,0.16362422017299955,0.15924191292117978,0.17151572055929432,0.1639660114369485,20.00714492797852,0.03779305184019937,Validea's Top Five Basic Materials Stocks Based On Joseph Piotroski - 11/24/2019,negative,0.16577904083999156
2019-12-06,0.15672305315650542,0.15924191292117978,0.1675269809204545,0.16577904083999156,20.163753509521484,0.10097724240082204,January 2020 Options Now Available For Alcoa (AA),negative,0.17325779253079807
2019-12-12,0.15972840111032582,0.16403442520321684,0.17045987639747096,0.17325779253079807,20.809778213500977,0.05472638453221448,"Machine Learning Answers: If Freeport-McMoRan Stock Drops 10% A Week, What's The Chance It'll Recoup Its Losses In A Month?",positive,0.1667988725808302
2019-12-13,0.17108192367108738,0.16675744024017677,0.1737447273871674,0.1667988725808302,20.251848220825195,0.07724931186976244,January 2020 Options Now Available For Alcoa (AA),negative,0.1757507025567284
2019-12-23,0.16974620639255417,0.1663217478622843,0.18160488816062015,0.1757507025567284,21.025115966796875,0.024806357758866207,Validea's Top Five Basic Materials Stocks Based On Joseph Piotroski - 12/22/2019,negative,0.1759773366353626
2020-01-03,0.16829919880210692,0.16697528642912296,0.18031440699034362,0.1759773366353626,21.04469490051269,0.04378262653736004,February 14th Options Now Available For Alcoa (AA),negative,0.15682718925107805
2020-01-09,0.16039624913433936,0.15510293920598128,0.16365555978584148,0.15682718925107805,19.39048385620117,0.11185264937419578,Why Shares of Alcoa Fell 19% in 2019,positive,0.15274788390073885
2020-01-10,0.1541629513723649,0.1487855451512325,0.1590802500020852,0.15274788390073885,19.038110733032227,0.09561295297424408,AA February 28th Options Begin Trading,negative,0.16317281377474407
2020-01-14,0.15227069761223788,0.15532078539492752,0.1630689896409249,0.16317281377474407,19.938629150390625,0.07433806465854742,What to Watch As Earnings Season Gets Underway,negative,0.1338243705950885
2020-01-16,0.14882012471924383,0.1451911661334436,0.14019239596970998,0.1338243705950885,17.403474807739258,0.5243054966625715,Alcoa Corporation (AA) Q4 2019 Earnings Call Transcript || Alcoa Q4 Results Miss View || Alcoa Q4 19 Earnings Conference Call At 5:00 PM ET || Can Alcoa Beat Consensus For FY 2019 Amidst the Fall In Alumina And Aluminum Prices?,neutral,0.13280453885424987
2020-01-17,0.13368209463822828,0.13037795768439575,0.13761145600537353,0.13280453885424987,17.31538200378418,0.19707118404474513,Shares of AA Now Oversold || Why Shares of Alcoa Are Dropping Today || Stock Market News: Alcoa Falls on Supply Fears; XPO Soars on Breakup Plans,positive,0.12033994549856733
2020-01-22,0.12266250670472646,0.11806993885831757,0.1257625555930811,0.12033994549856733,16.238676071166992,0.2926638848644764,Break-Up of Smith & Wesson Parent Thrown Into Turmoil After CEO Ousted,positive,0.10810198622151904
2020-01-24,0.11409170901294526,0.10935627827507222,0.11232988893805379,0.10810198622151904,15.181544303894045,0.16537909375152685,Interesting AA Put And Call Options For March 6th,negative,0.1085552435722798
2020-02-07,0.10663401613011038,0.10260320222990899,0.11238854819016714,0.1085552435722798,15.220699310302734,0.09560029537767359,3 Beaten-Down Stocks to Sell Now,neutral,0.10991501562456207
2020-02-14,0.10852626989023732,0.10510838146540066,0.11309244802741872,0.10991501562456207,15.338156700134276,0.07619366831578273,Interesting AA Put And Call Options For April 3rd || Analysts See 21% Gains Ahead For The Holdings of IGE,neutral,0.08487252268038759
2020-02-27,0.08581923538396703,0.08528482493284742,0.08587518158090088,0.08487252268038759,13.174959182739258,0.1449320122515409,AA Stock Crowded With Sellers || First Week of AA October 16th Options Trading,negative,0.08951841322731235
2020-02-28,0.07557880701689874,0.08310641498077509,0.0827076490954311,0.08951841322731235,13.576275825500488,0.14000820718561632,Interesting AA Put And Call Options For April 9th,negative,0.0571104856316485
2020-03-06,0.05910507027260299,0.05979741291238411,0.05889254095472796,0.0571104856316485,10.776841163635254,0.23502878464036098,AA April 24th Options Begin Trading,negative,0.012691222031062904
2020-03-25,0.020926086980936814,0.018625418074565955,0.014429845970683045,0.012691222031062904,6.939855575561523,0.2869983446395205,Wait For Battered Alcoa Stock To Hammer Out A Bottom,positive,0.006572242392538757
2020-03-27,0.00512021418353413,0.005554947974653945,0.003167526891415584,0.006572242392538757,6.411291122436523,0.22259902480812982,Interesting AA Put And Call Options For June 19th,negative,0.0
2020-04-03,0.0,0.0,0.0,0.0,5.843573570251465,0.16884221217321568,Interesting AA Put And Call Options For May 22nd,negative,0.014957508784866735
2020-04-23,0.020703469203723443,0.019605705149868008,0.017069450781187004,0.014957508784866735,7.1356201171875,0.49249948800021875,Alcoa Corp. Q1 adjusted earnings Beat Estimates || Alcoa Q1 20 Earnings Conference Call At 5:00 PM ET,neutral,0.013371108057204054
2020-04-24,0.0138023128024823,0.012743706010231656,0.014488499628742199,0.013371108057204054,6.998584747314453,0.2534000203027849,"BUZZ-U.S. STOCKS ON THE MOVE-Sleep Number, Crocs, Cassava Sciences || Interesting AA Put And Call Options For June 5th || BUZZ-U.S. STOCKS ON THE MOVE-Expedia Group, Crocs, Enzo Biochem || Alcoa Corporation (AA) Q1 2020 Earnings Call Transcript || BUZZ-U.S. STOCKS ON THE MOVE-Immunomedics, Helix Energy, Sleep Number Corp || BUZZ-U.S. STOCKS ON THE MOVE-Aytu BioScience, QEP Resources, Immunomedics",negative,0.019716716371108597
2020-05-06,0.02048085142651007,0.018080818183417377,0.021175503330199186,0.019716716371108597,7.546725273132324,0.12542412441708606,How to Handle Spinoff Shares,negative,0.02379603252795548
2020-05-08,0.017698126557529614,0.019605705149868008,0.019943687006090116,0.02379603252795548,7.899101257324219,0.25376202756470123,COLUMN-Trump's tariff wall breached by rising tide of aluminium: Andy Home || AA June 26th Options Begin Trading || Why Alcoa Stock Jumped 32% in April || COLUMN-Trump's tariff wall breached by rising tide of aluminium: Andy Home,negative,0.020056656682552257
2020-05-19,0.019479074082863104,0.020858289573874852,0.02205536973568245,0.020056656682552257,7.576090335845947,0.23561609712123222,"Why Dow, Alcoa, and Freeport-McMoRan Stocks Are All Hopping Today || Analysts Forecast 14% Upside For The Holdings of IYY",neutral,0.025382438658871978
2020-05-22,0.02504452382082399,0.02274261963584337,0.026278746382975476,0.025382438658871978,8.036136627197266,0.07929984251418348,July 2nd Options Now Available For Alcoa (AA),negative,0.03977336765040701
2020-05-28,0.04352181525241368,0.04781614259476924,0.042585638074797524,0.03977336765040701,9.279241561889648,0.3635008583116235,"Why Alcoa, Century Aluminum, and Tronox Stocks Jumped at Least 10% Today",neutral,0.03671388323439877
2020-05-29,0.035952800211905916,0.034745672494857244,0.03742374695801627,0.03671388323439877,9.014960289001465,0.16835109742628027,Alcoa considering more than 500 layoffs at Spanish plant || Alcoa considering more than 500 layoffs at Spanish plant,negative,0.07943342366475076
2020-06-08,0.07402047726877863,0.07363032389865193,0.07648991381682657,0.07943342366475076,12.705121994018556,0.252263368130754,Why Shares of Alcoa Gained 13% in May,neutral,0.06300283119153846
2020-06-12,0.057324128054895965,0.05816359765772133,0.06176677717963103,0.06300283119153846,11.285829544067385,0.22538875909226808,"Why Metals Stocks Alcoa, U.S. Steel, and Freeport-McMoRan All Crashed Today || July 31st Options Now Available For Alcoa (AA)",negative,0.06164305913925616
2020-06-15,0.05398485608906883,0.057183310582419294,0.05748475246833304,0.06164305913925616,11.168371200561523,0.14363587436272168,"Why Metals Stocks Alcoa, U.S. Steel, and ArcelorMittal Popped Friday",negative,0.06322946527017267
2020-06-16,0.06645147284352383,0.06382747392058744,0.0656968575663574,0.06322946527017267,11.30540657043457,0.20507584811592944,GRAPHIC-Canadian exemption from U.S. aluminium import levy under scrutiny,negative,0.06322946527017267
2020-06-17,0.06121994711756977,0.06023309490279857,0.0656968575663574,0.06322946527017267,11.30540657043457,0.13290223247093755,5 Great Stocks for Beginners to Buy Now,neutral,0.06640226672549804
2020-06-22,0.05977292891186957,0.06132229468509573,0.06511027623333249,0.06640226672549804,11.579475402832031,0.16569047062716113,COLUMN-Friend or foe? Canadian imports split U.S. aluminium sector: Andy Home,negative,0.06640226672549804
2020-06-25,0.05520926182518213,0.060559853798739904,0.05959642960387121,0.06640226672549804,11.579475402832031,0.13787413640383,COLUMN-COVID-19 will tilt aluminium axis further towards China: Andy Home || Why Alcoa Stock Dropped 9% Today || COLUMN-COVID-19 will tilt aluminium axis further towards China: Andy Home,negative,0.05665722828088775
2020-07-02,0.05799198669416257,0.05881712583708204,0.05959642960387121,0.05665722828088775,10.737688064575195,0.15779213036716905,"Notable Wednesday Option Activity: IIPR, USPH, AA",negative,0.051558080383202226
2020-07-09,0.055431874294769035,0.05207493586887929,0.05490380131588825,0.051558080383202226,10.29721736907959,0.1719407918136741,"BUZZ-U.S. STOCKS ON THE MOVE-Levi Strauss, KKR, Allstate, National General || Alcoa Sees Q2 Above View - Quick Facts",neutral,0.07614730517010829
2020-07-15,0.07569011855931869,0.0728678830122961,0.07443688474529339,0.07614730517010829,12.421263694763184,0.2664500023669706,"Why Alcoa Stock Jumped as Much as 10% Today || Tuesday Sector Leaders: Oil & Gas Exploration & Production, Metals Fabrication & Products",neutral,0.08521246299183124
2020-07-16,0.07524488300489192,0.08081908193422963,0.08176912343783449,0.08521246299183124,13.204322814941406,0.3902235761912634,"Alcoa Corporation (AA) Q2 2020 Earnings Call Transcript || Alcoa Posts Narrower Loss, Shares Up 5% || After-Hours Earnings Report for July 15, 2020 : AA, SNBR || Alcoa Q2 20 Earnings Conference Call At 5:00 PM ET",positive,0.08033994917277995
2020-07-17,0.0833704345269934,0.08256180989588749,0.08212106776240613,0.08033994917277995,12.783429145812988,0.21451588363820845,"BUZZ-U.S. STOCKS ON THE MOVE-American Airlines, Tesla, Walt Disney, Lannett",negative,0.0763739392487425
2020-07-23,0.0775823723194456,0.07504629296436843,0.08024401644721296,0.0763739392487425,12.440841674804688,0.11145520084188207,Alcoa To Supply ECOLUM Rolling Slabs To Grnges - Quick Facts,negative,0.07682719659950327
